{
  "run_id": "123100Z-48ecf1a3df",
  "timestamp": "2026-02-12T12:29:15Z",
  "trigger": "local",
  "inputs": {
    "ssot_path": "ai/projects/topru-ai/PROJECT_STATE.md",
    "ssot_hash": "91fe1ac8c17ee9d69bb6a1278303d7bf72d60f054a05dd3de892ccdf0ded24df",
    "read_files": [
      "ai/ai-change-gates/START_HERE.md",
      "ai/ai-change-gates/prompts/navigator.prompt.md",
      "ai/ai-change-gates/prompts/navigate-patch.prompt.md"
    ]
  },
  "outputs": {
    "written_files": [
      {
        "path": "ai/projects/topru-ai/PROJECT_STATE.md",
        "added_lines": 3,
        "removed_lines": 0
      },
      {
        "path": "ai/ai-change-gates/runs/2026-02-12_run-123100Z-48ecf1a3df.json",
        "added_lines": 43,
        "removed_lines": 0
      },
      {
        "path": "ai/ai-change-gates/runs/2026-02-12_run-123100Z-48ecf1a3df.md",
        "added_lines": 33,
        "removed_lines": 0
      }
    ],
    "diff_summary": "mode=navigate_patch; updated=ai/projects/topru-ai/PROJECT_STATE.md; created=ai/ai-change-gates/runs/2026-02-12_run-123100Z-48ecf1a3df.json,ai/ai-change-gates/runs/2026-02-12_run-123100Z-48ecf1a3df.md"
  },
  "roles": {
    "navigator": {
      "summary": "add black-box run record contract for NAVIGATE and NAVIGATE+PATCH"
    },
    "patch": {
      "summary": "added run_record tool/template/schema and gate wiring"
    },
    "implement": {}
  },
  "verifier": {
    "status": "pass",
    "fail_codes": []
  },
  "latency_ms": {
    "navigator": 0,
    "patch": 0,
    "verifier": 0,
    "implement": null
  },
  "next_actions": [
    "Run quick gatecheck in env with rg installed",
    "Adopt run_record.sh at NAVIGATE/NAVIGATE+PATCH invocation entrypoints"
  ],
  "notes": "bootstrap verification after script rebuild"
}
