{
  "run_id": "123600Z-48ecf1a3df",
  "timestamp": "2026-02-13T01:11:44Z",
  "trigger": "local",
  "inputs": {
    "ssot_path": "ai/projects/topru-ai/PROJECT_STATE.md",
    "ssot_hash": "a63facd7d603be3ffe6fdaaf763e9e3d28d9b8e6f223b5f4a5f854a5eec53b1b",
    "read_files": [
      "ai/projects/topru-ai/PROJECT_STATE.md"
    ]
  },
  "outputs": {
    "written_files": [
      {
        "path": "ai/projects/topru-ai/PROJECT_STATE.md",
        "added_lines": 3,
        "removed_lines": 0
      },
      {
        "path": "ai/ai-change-gates/runs/2026-02-13_run-123600Z-48ecf1a3df.json",
        "added_lines": 42,
        "removed_lines": 0
      },
      {
        "path": "ai/ai-change-gates/runs/2026-02-13_run-123600Z-48ecf1a3df.md",
        "added_lines": 32,
        "removed_lines": 0
      }
    ],
    "diff_summary": "mode=navigate_patch; updated=ai/projects/topru-ai/PROJECT_STATE.md; created=ai/ai-change-gates/runs/2026-02-13_run-123600Z-48ecf1a3df.json,ai/ai-change-gates/runs/2026-02-13_run-123600Z-48ecf1a3df.md"
  },
  "roles": {
    "navigator": {
      "summary": "gatecheck fail-codes integration smoke"
    },
    "patch": {
      "summary": "record verifier fail_codes in run record"
    },
    "implement": {}
  },
  "verifier": {
    "status": "fail",
    "fail_codes": [
      "E_NO_RUN_RECORD",
      "E_TOO_MANY_ACTIONS"
    ]
  },
  "latency_ms": {
    "navigator": 0,
    "patch": 0,
    "verifier": 0,
    "implement": null
  },
  "next_actions": [
    "Fix run record generation then rerun quick gatecheck"
  ],
  "notes": "smoke for fail_codes + min_fix rendering"
}
